id,date,sender,text,clearedmsg
1850,2023-07-20 20:34:35+08:00,John,buffet food available at sbs foyer. will be cleared by 9pm,-2
1853,2023-07-21 13:23:24+08:00,Angela,"bring your own containers. rice, pad thai, prawns, fish,  chicken and potato salad. hss foyer till 2 pm.",-2
1854,2023-07-22 14:04:18+08:00,yunjie,"helloo we got some leftover fried rice, beehoon and nonya chap chye at the arc, outside tr-25, please bring ur own containers     was to be consumed by 1pm, take at ur own risk. will clear by 4pm, thank youu ",-2
1856,2023-07-25 12:39:10+08:00,Rachel,hello  we have free food outside of lt1a,-2
1858,2023-07-25 20:56:00+08:00,ND19,free food at lkc lt,-2
1859,2023-07-26 19:42:53+08:00,sophia,hi 2 veg bentos at crespion canteen  consume by 7pm so consume at own risk ~,-2
1861,2023-07-27 13:22:52+08:00,Shoee,"hi there's free food at the l3 mas atrium, clearing approx at 2pm",-2
1862,2023-07-27 13:22:52+08:00,Shoee,**white cloth table only,-2
1863,2023-07-27 13:40:01+08:00,Poh Yi,"hi, free bentos, salad and soya pudding at entrepreneurship academy, borderx, research techno plaza.",-2
1864,2023-07-27 15:38:10+08:00,Juu,free food at spms mas atrium,-2
1865,2023-07-27 15:38:10+08:00,Juu,consume by 4pm,-2
1867,2023-07-27 17:11:23+08:00,weijun,"free food outside lt26, please come before 6pm",-2
1868,2023-07-27 18:30:21+08:00,Lee Xiangjun,"hi, there is free food outside shhk auditorium. clearing time will be about 715pm",-2
1870,2023-07-28 11:41:22+08:00,LY,hi there is a lot of extra cupcakes at the shhk lvl 1 (outside undergrad education office),-2
1873,2023-07-28 14:57:01+08:00,Gorilla 🦍,"hi we have extra 27 boxes of fried rice, n 2 boxes of vege bento placed outside sac, to be consumed by 1400    please take   ",-2
1874,2023-07-28 18:01:48+08:00,Poh Yi,"hi, a lot of free non-veg bentos, salad and doughnuts at entrepreneurship academy, borderx, rtp. (consume by 2:30pm, so take at your own risk)",-2
1875,2023-07-28 20:00:57+08:00,Leanne,buffet spread leftovers at **experimental medicine building **level 3 collaboration space. buffet will be cleared by 8.30pm.,-2
1876,2023-07-29 13:09:38+08:00,Kimberly Wong,"have some rice and noodles at gaia level 2, not many plates left. recommend to bring own container",-2
1877,2023-07-29 13:09:38+08:00,Kimberly Wong,have some jelly dessert and fruit punch in the same place too,-2
1878,2023-07-29 13:30:08+08:00,🧞‍♀️,"hi  consume by 2pm, we have 14 bentos at north spine canteen (near the staircase )  :)",-2
1880,2023-07-29 15:03:51+08:00,c,"hi  we have 30 bentos at tct lt, to be consumed by 2pm. there’s a mix of vegetarian and non-vegetarian options. pls take some, thank you  ",-2
1881,2023-07-29 15:13:17+08:00,druce,hii we have 35 bento + 4 vegetarian bento outside of koufu,-2
1882,2023-07-29 16:14:14+08:00,Afif,outside lt8 nie  8x nasi sambal goreng,-2
1883,2023-07-29 19:10:03+08:00,druce,hii there are 31 bento + 6 vegetarian bento consume by 8.30pm   koufu,-2
1884,2023-07-29 20:16:28+08:00,druce,hi again 5 free bento consume by 8.30pm  koufu,-2
1885,2023-07-29 23:04:18+08:00,NTUFreeFood,"outside sac room 35 boxes, consumed best before 830. green stickers are vegetarian",-2
1887,2023-07-30 13:42:32+08:00,Eugene 💜,"for ntu free food - shhk foyer have big buffet, there are plates but byoc recommended, clearing by 2.30",-2
1889,2023-08-01 12:53:45+08:00,k for kenneth,free food at the arc lvl 2,-2
1890,2023-08-01 12:53:45+08:00,k for kenneth,consume by 2pm,-2
1891,2023-08-01 13:07:20+08:00,Phui Qing,hi there is some extra bento boxes placed at hall 4 admin office,-2
1893,2023-08-01 13:07:28+08:00,Tharshini,some food left at the hive tr+4 basement 4 ,-2
1895,2023-08-01 19:08:43+08:00,Jun Rong,free food at spms lv3 outside of lt2,-2
1896,2023-08-01 19:08:43+08:00,Jun Rong,clear by 9pm ,-2
1897,2023-08-02 12:34:28+08:00,恩,hello free food at hall 2 block 2 outside conference room ,-2
1898,2023-08-02 12:34:29+08:00,恩,by 1.30 ,-2
1899,2023-08-02 12:55:45+08:00,HOth,"free food at gaia building, outside seminar room 2 level 1. to be cleared before 3pm.",-2
1900,2023-08-02 13:04:31+08:00,Phui Qing,hello  we have extra bento boxes placed at hall 4 admin office :),-2
1901,2023-08-02 14:28:02+08:00,vas,"hi  free bento sets w utensils outside lt2a, consume by 4pm  ",-2
1904,2023-08-03 13:52:55+08:00,恩,"hello free food at hall 2, block 2 outside conference room   consume by 2.30 (:",-2
1905,2023-08-03 14:30:04+08:00,Yun Ning,hi free food at arc b2. clear by 3.30pm,-2
1907,2023-08-03 20:45:59+08:00,vas,"free two boxes of bread (cookies & cream, chocolate), expiring 5th aug at function hall 12",-2
1908,2023-08-03 23:04:11+08:00,Jiayi,hi there’s free bread expiry 06 aug 2023. collect it at ntu hall 7 admin office,-2
1909,2023-08-04 20:01:03+08:00,S,bento outside lt5. consume by 8pm,-2
1910,2023-08-05 12:42:25+08:00,Amay Jolly,"got many nonveg bentos, veg bentos and fruits for free at south spine b3 benches",-2
1911,2023-08-05 13:06:24+08:00,Lee Xiangjun,a lot of bentos here at the benches outside lt 19a,-2
1912,2023-08-05 13:09:19+08:00,Raymond Chen Hock Yew,"hello, a lot of bento at lt19a consume by 2pm, thanks  ",-2
1913,2023-08-05 13:09:27+08:00,poon min,hi  there are 80+ free bento sets and 6 vegetarian bento sets at southspine carpark benches (nbs side),-2
1915,2023-08-06 13:56:39+08:00,Limya,hi  we have 25+ non-veg bento sets. placed near the lifts at arc lvl 1. please consume by 2.30pm. thank you ,-2
1916,2023-08-06 13:56:46+08:00,֎⸙ Chew Zi Shin ⸙֍,hello  there are 19 free bento sets at adm benches.,-2
1917,2023-08-06 13:56:46+08:00,֎⸙ Chew Zi Shin ⸙֍,hello  there are free white fungus dessert at adm benches.,-2
1918,2023-08-06 13:56:56+08:00,poon min,hello  there are about 20 free bentos at southspine carpark (along nbs side)  while stocks last ,-2
1919,2023-08-06 14:25:58+08:00,NTUFreeFood,southspine cleared,1918
1920,2023-08-07 10:25:23+08:00,Jeremy,free to take  food left at experimental medicine building lobby. it'll be cleared at 1130,-2
1921,2023-08-07 11:53:04+08:00,Khor Zhi Yi,"hi we have some free food at s4-b1a reading room, consume by 1230pm",-2
1922,2023-08-07 12:50:51+08:00,dezyrae,"hi there’s free bento sets at wkw benches  22 standard, 4 veg    to be cleared by 1.45pm",-2
1923,2023-08-07 12:58:59+08:00,yongxin,hello  14 packets of bento at ss benches nbs side between s4 and s3. consume by 145.,-2
1926,2023-08-07 13:09:14+08:00,Jaze x,hii there are extra 8 vegetarian and many non veg bentos in sbs lobby to be consumed by 2pm ,-2
1927,2023-08-07 13:09:44+08:00,֎⸙ Chew Zi Shin ⸙֍,hello  11 packets of bento and 3 packets of vegetarian bento at ss benches school of eee side. consume by 145.,-2
1928,2023-08-07 13:13:18+08:00,Wei Jie,outside lt22.   non-veg and veg   fruits too.,-2
1929,2023-08-07 13:22:02+08:00,poon min,hello  there are 50 bento boxes at ss benches along eee side (1st table closest to canteen)  to be cleared by 1.45pm,-2
1930,2023-08-07 13:43:33+08:00,Mika Yap,hi 13 bentos at spms mas atrium,-2
1931,2023-08-07 18:39:16+08:00,NTUFreeFood,cleared by 7pm,-2
1932,2023-08-07 18:39:16+08:00,Yash,free food outside the hive tr52,-2
1933,2023-08-07 19:30:16+08:00,ndrea,9 bento boxes at adm lt1a-basement clear by 8pm,-2
1934,2023-08-07 20:36:52+08:00,𝓜𝓲𝓬𝓱𝓪𝓮𝓵 𝓝𝓰,extra pizza and kfc at tct lecture theatre,-2
1935,2023-08-07 20:57:14+08:00,NTUFreeFood,cleared,1934
1936,2023-08-08 12:42:03+08:00,Jordi Ong,"halal bentos at shhk undergraduate office, clear by 1.30pm",-2
1937,2023-08-08 12:47:52+08:00,Wei Jie,itea   milk tea w/ pearl grapefruit green tea w/ pomelo  outside lt23,-2
1938,2023-08-08 12:59:18+08:00,NTUFreeFood,itea cleared,1937
1939,2023-08-08 13:25:25+08:00,Sussus Amaungus,30ish chicken horfun with soup and 9 vegetarian bee hoon,-2
1940,2023-08-08 13:29:10+08:00,dezyrae,"hi  29 bentos at wkw benches, 2 veg the rest are standard    to be cleared by 1.45pm",-2
1941,2023-08-08 14:42:44+08:00,Chiew Kitt,outside ss lt 26. bananas and bento set,-2
1942,2023-08-08 15:42:20+08:00,Sophia,free vegetarian bento at upo. consume at own risk as best consumed by 12:45pm,-2
1944,2023-08-08 19:43:42+08:00,bao,"from enitio, outside lt23 benches,  expires 08092023",-2
1945,2023-08-10 12:16:24+08:00,dezyrae,hi free bentos at wkw benches  to be cleared by 12.45pm,-2
1946,2023-08-10 13:14:30+08:00,Jordi Ong,"halal bentos at shhk, clear by 1.30",-2
1947,2023-08-10 13:39:56+08:00,Jaze x,hello there are extra veg/non veg bentos in spms lobby beside the lift,-2
1949,2023-08-10 13:59:03+08:00,Michael Yuhas,"free food in front of graduate college, abn",-2
1950,2023-08-10 15:35:59+08:00,Randall,hello  we have food for about 200 pax  (non-veg) in spms building near lt1  to consume before 530. pls come and take ,-2
1951,2023-08-10 19:23:48+08:00,ndrea,"free bentos at adm lvl 1 14 thai rice with green curry, 12 bolognese, 1 vegetarian bolognese consume by 7:00pm so eat at own risk",-2
1952,2023-08-11 12:33:05+08:00,Engel 🍖🍳🍞,free mcdonalds chicken ham wrap at wkw lvl 3 benches ,-2
1954,2023-08-11 12:57:02+08:00,NTUFreeFood,mcdonalds cleared,1953
1955,2023-08-11 13:02:33+08:00,WKid,"hello  free food in spms atrium (non veg), consume by 1pm ",-2
1956,2023-08-11 13:27:23+08:00,Jaze x,7 non-vegetarian halal nasi lemak set at north spine tr+9    to be consumed by 2-2.30pm,-2
1958,2023-08-11 14:12:01+08:00,kev,hi free buffet at south spine lt27,-2
1959,2023-08-11 14:50:00+08:00,Charlotte Tan,halal bento with fish benches outside block s4,-2
1960,2023-08-11 15:07:03+08:00,renelyn🍃,location: lt19a food consumed by 2.45pm so its at ur own risk  and its halal,-2
1961,2023-08-11 15:48:54+08:00,keziah (-‿◦),there is free traditional ice cream from  werk.sg at adm   still have around 130 left  ,-2
1962,2023-08-11 17:28:25+08:00,worm,there are some snacks outside lt29 ,-2
1963,2023-08-11 19:45:39+08:00,Yvettty,"buffet avail at gaia outside seminar room 2, clearing at 8pm",-2
1964,2023-08-11 19:45:46+08:00,renelyn🍃,"free food located outside of nanyang auditorium, consumed by 6pm so its at your own risk  ",-2
1965,2023-08-11 21:09:29+08:00,dezyrae,hi free bentos at wkw benches ,-2
1966,2023-08-11 21:09:37+08:00,Verlin,"hello  there's free lotus buns at adm basement, 2 trays ",-2
1967,2023-08-11 22:09:53+08:00,dezyrae,hi free honey cake at wkw benches ,-2
1968,2023-08-12 13:59:08+08:00,Kimberly Wong,free food outside abs seminar room 2,-2
1969,2023-08-13 13:38:14+08:00,Kimberly Wong,"free food outside abs seminar room 2. limited cutlery available, please bring your own container",-2
1971,2023-08-14 19:15:06+08:00,Angela,free food at arc lt. bring your own plates. clearing at 8 pm.,-2
1972,2023-08-14 20:37:58+08:00,leah,free food outside lt24. clearing at 9pm.,-2
1973,2023-08-14 20:42:01+08:00,NTUFreeFood,cleared lt24,-2
1974,2023-08-16 14:27:47+08:00,sean,hello  free food at lkc level 2,-2
1976,2023-08-16 15:27:02+08:00,Yvettty,"6+2veg bento up for grab, at table outside lwn library (atm area)",-2
1977,2023-08-16 15:29:44+08:00,Killer Whale,outside arc reading room,-2
1978,2023-08-17 14:18:00+08:00,Grace Hoe,"hi, there are 12 bento + 2 vegetarians up for grabs outside south spine lt28. to consume by 2.45pm.",-2
1979,2023-08-17 20:04:09+08:00,Yihan,"hi, there are a lot of excess bentos at lkc lt. best to consume before 2100.",-2
1980,2023-08-17 21:40:51+08:00,shyan,hi  free food at north spine aia canopy,-2
1982,2023-08-17 21:44:41+08:00,shyan,head to global lounge (beside aia canopy stage) to collect by 10pm ,-2
1984,2023-08-18 18:51:57+08:00,Vera,"hi, we have some snacks at lhn-tr+31",-2
1985,2023-08-18 19:57:13+08:00,Zihao Liu,we have left some snacks after today's meeting in hive tr10. feel free to pick.,-2
1987,2023-08-18 21:31:48+08:00,jia xuan,hiii there’s free food at ns3 ,-2
1988,2023-08-18 21:42:55+08:00,NTUFreeFood,it’s on the tables at the end of the corridor,-2
1989,2023-08-19 14:31:39+08:00,Faith,"in fromt of lt2a, four boxes of non-vege food. its supposed to be consumed by 2pm  ",-2
1991,2023-08-19 19:26:43+08:00,don,"lkc-lt (south spine)  beehoon, fruit-punch, and dessert consume by 9pm",-2
1994,2023-08-22 15:29:45+08:00,Aldrich,"free food at ntu npcc booth, at northspine aia canopy until 4pm",-2
1995,2023-08-22 21:26:05+08:00,Jermaine,"hi, we got free food at hall 5 mph",-2
1996,2023-08-22 21:26:05+08:00,Jermaine,about 16 packets,-2
1997,2023-08-23 14:01:06+08:00,Elis,"hi  we have food at the hive b1-09, food till 2.30pm",-2
1999,2023-08-23 21:57:19+08:00,Cheryl,"hiii i currently have vegetarian indian food (rice, curry, some rice cakes)   i can only give away at 11.45 pm when i am back in binjai hall :)",-2
2001,2023-08-23 22:08:25+08:00,NTUFreeFood,cleared,1999
2002,2023-08-24 21:14:26+08:00,Janeil,"hi guys hall 8 has 20+ bbt left     come to hall 8 comms hall lvl1 to get it  **here's the steps to redeem the free bbt: **1. download partipost & create account on paritpost (do complete the verification ) 2. using instagram, follow capitastar and take a screenshot as proof. then, upload the screenshot on the campaign in partipost   ",-2
2003,2023-08-24 22:19:08+08:00,Zong Han,"bento, drinks and snacks at adm  will clear by 11  (bento best before 8:30pm)",-2
2004,2023-08-25 14:20:10+08:00,theresa✨,🍋free lemons and lime   tamarind hall blk 24 lvl 3 lift lobby.  must clear by 6pm today,-2
2005,2023-08-25 14:35:39+08:00,NTUFreeFood,cleared,2004
2006,2023-08-25 18:19:15+08:00,林政谚,"hi, free food outside shhk staff lounge, level 2. access via staircase. food to be consumed by 7:30pm.",-2
2010,2023-08-26 23:35:53+08:00,NTUFreeFood,macaron bits at delivery place crescent hall cleared by tmr morning,-1
2011,2023-08-28 13:20:01+08:00,Shi Min,food at arc level 2 to be cleared by 2pm (28aug),-2
2012,2023-08-29 21:17:45+08:00,TT,tr 1 hive,-2
2014,2023-08-30 16:24:18+08:00,Ying Xi Soo,free food outside spms lt2,-2
2015,2023-08-30 21:50:00+08:00,Alfonso Yuji,"buffet food courtesy of cas ntu at lhs-tr+1 (the hive, b5). consume by today at your own risk.",-2
2016,2023-08-31 16:34:10+08:00,Toshan Aggarwal,free food outside the student activities centre. payasa(kheer).,-2
2017,2023-08-31 21:40:05+08:00,Gerard Ng,hi  there is free food at lkc lt,-2
2018,2023-08-31 21:46:37+08:00,NTUFreeFood,hi  there’s a lot of leftover liho bbt at shhk foyer :) with straws too ,-2
2020,2023-08-31 22:03:05+08:00,NTUFreeFood,liho cleared,-1
2021,2023-08-31 22:03:17+08:00,NTUFreeFood,lkc lt cleared,-1
2022,2023-08-31 22:22:56+08:00,NTUFreeFood,free succulents at lkc lt,-2
2023,2023-08-31 22:29:55+08:00,NTUFreeFood,cleared,2022
2024,2023-08-31 22:59:56+08:00,Zack,more free food outside lkc (at the benches),-2
2025,2023-08-31 23:17:34+08:00,Salmah :D,hi  finger food at the arc lt,-2
2027,2023-09-01 17:20:09+08:00,Alfonso Yuji,"free tea food available at lhs-tr+1 (the hive b5), at cas ntu’s polling day event.",-2
2028,2023-09-01 20:16:42+08:00,Alka,food at tr+33 (the arc),-2
2031,2023-09-02 13:56:02+08:00,Nicholas,"hi we got 8 free nasi lemak at src the wave, outside activity room 2, bento set consume by 2:30 pm",-2
2036,2023-09-05 13:10:05+08:00,🐆💰 Haydn 💰🐆,outside graduate college  we have catering. to be eaten by 2:10pm,-2
2037,2023-09-05 13:23:44+08:00,NTUFreeFood,cleared,2033
2038,2023-09-06 16:53:32+08:00,LauPaSat,free food at gaia next to seminar room 2,-2
2040,2023-09-08 13:51:25+08:00,Harshan Elangovan,hello we got free food veg and non about 30 in nanyan auditorium,-2
2044,2023-09-08 13:59:54+08:00,NTUFreeFood,finished,2040
2045,2023-09-08 14:48:25+08:00,Wesley,"free food at lkc lvl2 foyer, clear by 4pm",-2
2046,2023-09-08 14:48:25+08:00,Wesley,admin say can open send after 3pm+,-2
2047,2023-09-08 15:11:00+08:00,Jiarong,"free food  gaia lvl 1 event area, not sure clearing when",-2
2048,2023-09-08 15:11:09+08:00,Wesley,"free food at lkc lvl2 foyer, clear by 4pm",-2
2050,2023-09-08 19:10:35+08:00,Dong,free food at the tctlt,-2
2062,2023-09-08 19:16:23+08:00,MS,hi we have free food at nanyang auditorium,-2
2063,2023-09-08 19:16:23+08:00,MS,we are going to disassemble them by 7.30,-2
2064,2023-09-09 13:44:45+08:00,sim eng,hi we have a lot of remaining food outside of lt 3  could you help us send in to the free food group?,-2
2065,2023-09-09 19:00:52+08:00,MS,"hi,  we have about 35 bento boxes - non veg at nanyang auditorium",-2
2067,2023-09-09 19:17:48+08:00,NTUFreeFood,cleared,2066
2068,2023-09-09 20:34:52+08:00,yan ying,halal thai style boneless chicken bento set with tofu 13x clear from annex b   nanyang hill by 9.30pm,-2
2069,2023-09-11 19:16:35+08:00,Yong An,vegetarian and non vegetarian food outside lt2a,-2
2070,2023-09-11 20:20:07+08:00,HK,"hello, we have a lot of bento set. halal and vegetarian option. location at arc lt. already expired at 1930. eat at own risk.",-2
2071,2023-09-11 20:26:14+08:00,NTUFreeFood,cleared,2070
2072,2023-09-12 14:28:20+08:00,𝙿𝚂🌻,"free food outside abs seminar room 11, abs-02-sr11, nbs. please bring your own container and cutlery.",-2
2075,2023-09-12 21:50:43+08:00,Salmah :D,"hello  :d at the hive tr 19 we have: - 7 bento sets (pineapple rice, salted egg fish, teriyaki chicken chop, mixed veggies - 7 mango pudding  - and cutlery thank youu",-2
2077,2023-09-13 14:52:17+08:00,LauPaSat,free food at gaia. they will clear at 3:10pm,-2
2079,2023-09-13 18:19:31+08:00,Kribalan,left cake near hall 11 canteen at the bbq spot (next to waffle shop),-2
2082,2023-09-14 14:17:48+08:00,Beef Don,hi there’s 1 non veg 3 veg outside hive tr 20.,-2
2083,2023-09-14 14:17:48+08:00,Beef Don,consume by 2pm so eat at own discretion,-2
2084,2023-09-14 19:59:30+08:00,Wan Sin,at lt2a bring own plate  cleared by 830pm,-2
2085,2023-09-18 18:20:39+08:00,Jingwen,sandwiches outside arc tr 20. plates provided,-2
2086,2023-09-20 14:31:31+08:00,Zhiqing~,outside the arc lt,-2
2087,2023-09-21 10:49:20+08:00,NTUFreeFood,chance to win a free supply of oatside for the entire school  like this post:  https://www.instagram.com/p/cxaezaey1io/?igshid=mzrlodbinwflza==,-2
2088,2023-09-22 11:29:20+08:00,Purvi,refreshments at abn level 1 near ntu graduate college,-2
2089,2023-09-22 11:51:09+08:00,Shannon Lee,aia canopy has food  beef bro and mee rebus ,-2
2091,2023-09-22 16:39:42+08:00,Harsha,good food at lhn-tr+34  come quick ,-2
2092,2023-09-22 18:17:52+08:00,Alyssa,free food at tr 5 clear by 630pm,-2
2095,2023-09-22 20:23:21+08:00,NTUFreeFood,chance to win a free supply of oatside for the entire school  like this post by 26 sep  https://www.instagram.com/p/cxfftbcypir/?igshid=mzrlodbinwflza==,-2
2098,2023-09-24 12:51:09+08:00,renee lee,food outside lt3,-2
2099,2023-09-24 12:51:09+08:00,renee lee,^ near the skydeck near library,-2
2100,2023-09-24 12:59:52+08:00,yun rong,"hi there's 11 bento boxes outside tama function hall, consume by 1pm according to packaging, eat at your own risk",-2
2101,2023-09-24 13:14:56+08:00,NTUFreeFood,cleared,2100
2102,2023-09-26 14:35:13+08:00,Zhiqing~,"food outside gaia, lt 6 (level 2). plates and cutlery still have. no more cups so bring own bottle if you want the drinks (fruit punch) clearing by 3pm.",-2
2103,2023-09-26 20:45:15+08:00,Yezhou,free food here at arc. hav to clear by tonight,-1
2105,2023-09-26 20:54:48+08:00,NTUFreeFood,cleared,2103
2106,2023-09-26 21:12:10+08:00,saniaaa,"hi 10 veg and 6 non veg bento boxes and coffee and tea at arc tr+15, to be consumed by 8.30pm eat at ur own risk",-2
2107,2023-09-26 21:20:43+08:00,NTUFreeFood,food cleared only beverages left,2106
2108,2023-09-27 14:44:11+08:00,Wesley,lkc keeping soon,-2
2110,2023-09-27 20:20:24+08:00,Diya Chakravarty,"hii weve got free food at ntu sss, in front of the shhk auditorium.",-2
2112,2023-09-27 20:20:24+08:00,Diya Chakravarty,have both non veg and veg,-2
2114,2023-09-28 17:06:55+08:00,Syd,"hi there’s food outside lt1a, clearing time 545pm",-2
2116,2023-09-28 17:46:36+08:00,Hui Ying Pak,"free coffee with cups, polar puff pastries and cakes that come in individual boxes location: the arc, level 1, tr 18",-2
2119,2023-09-29 13:33:56+08:00,jc (๑>ᴗ<๑),"halal buffet spread   nanyang audi foyer, clearing time should be 2.45pm",-2
2121,2023-09-29 17:33:43+08:00,~zhenxi~,beside aia canopy,-2
2122,2023-09-29 17:33:57+08:00,Harsha,free food at lhn-tr+31,-2
2123,2023-09-29 21:35:29+08:00,Abigail,🥪 and muffin outside lt2a (ns),-2
2124,2023-09-30 14:36:13+08:00,Gorilla 🦍,hi we hv 5 boxes of vegetarian bento at hive b5   best consume by 3.30pm  no utensils provided,-2
2125,2023-09-30 15:17:08+08:00,sanjana,"nanyang audi foyer, clear by 4 pm",-2
2126,2023-10-01 12:36:53+08:00,🦦,free bento meals  location: at the benches outside lt19 consume by: 1.30pm,-2
2127,2023-10-01 17:43:41+08:00,NTUFreeFood,"6 sweets at wkwsci 2nd floor, near seminar room 2",-2
2129,2023-10-01 18:02:37+08:00,renee,"free bento outside lt19, do note it’s consume by 6pm so consume at your own risk",-2
2130,2023-10-02 19:28:50+08:00,NTUFreeFood,36 more free ice cream left  need do survey,-2
2131,2023-10-02 19:28:50+08:00,PeerChannel(channel_id=1678345958),"drop happening right now at yunnan corner, bbq pit 1,2,3   ",-2
2135,2023-10-04 14:21:02+08:00,Janice Ng,hello  we have 10 bentos stated to consume by 1.45pm at arc level b2 tr+08 to clear,-2
2138,2023-10-05 13:00:23+08:00,amanda wu,"hello  we have 10 bentos to post on ntu free food at nanyang auditorium foyer (b1 level), to be cleared",-2
2141,2023-10-05 16:28:32+08:00,Jian Xin,"lt4, clear at 5:30",-2
2142,2023-10-05 19:35:09+08:00,amanda wu,hello  we have 7 bento boxes to be cleared at nanyang auditorium foyer (b1 level) to post on ntu free food,-2
2143,2023-10-05 19:47:17+08:00,NTUFreeFood,cleared,2142
2144,2023-10-06 13:02:27+08:00,Shao Quan,hi we have 11 normal and 3 vegetarian outside lt 2a. consume by 2pm,-2
2145,2023-10-06 13:42:28+08:00,amanda wu,hello  we have 8 bento boxes and 1 vegetarian bento to be cleared at nanyang auditorium foyer (b1 level) to post on ntu free food,-2
2146,2023-10-06 14:25:38+08:00,NTUFreeFood,cleared,2145
2147,2023-10-07 12:57:15+08:00,amanda wu,"hi i want to post 1 bento box left at nanyang audi foyer b1 level, come and take yourself thank youu",-2
2148,2023-10-07 13:01:12+08:00,NTUFreeFood,cleared,2147
2149,2023-10-07 16:54:16+08:00,Jocelyn Leong,"3 veg, 1 no peanut and prawns bento. consume by 2pm, on the bench outside gaia level 2, sr 13",-2
2150,2023-10-07 16:56:32+08:00,NTUFreeFood,cleared,2149
2151,2023-10-09 19:36:46+08:00,jazzy,"hi about 20 bentos left, at src main field vending machine. cutlery provided",-2
2152,2023-10-11 13:57:48+08:00,W,hi hi got free food at lkc threater level 2 function room (go up spiral staircase) clear by 2pm thxxx,-2
2153,2023-10-11 17:46:55+08:00,Siva,free food outside ns lt19. level b1.,-2
2154,2023-10-11 17:48:06+08:00,Aug🤡,"outside gaia seminar 7. carrot cakes, swiss roll, ngoh hiang, thai fish cake and eclair",-2
2155,2023-10-12 18:35:19+08:00,Eddie Tan ʕ•̫͡•ʕ•̫͡•ʔ•̫͡•ʔ,"hi there, just wanna let you know there are drinks outside tr+14 the arc",-2
2156,2023-10-12 20:43:20+08:00,Martina,"hii, there's 5 boxes of bento (halal) at nie recital and ensemble studio. clearing by 10pm",-2
2157,2023-10-13 17:05:10+08:00,A,hello  there is some free food outside lt3 (ns),-2
2158,2023-10-13 17:32:28+08:00,dx,hi there is some free food at n3.2 b2,-2
2159,2023-10-13 18:34:31+08:00,NTUFreeFood,cleared,2158
2160,2023-10-14 13:39:12+08:00,LauPaSat,free food at lkc function hall. will clear at 2pm,-2
2162,2023-10-14 13:48:56+08:00,Jiali Teo,hello  we have leftover food available outside lkc-lt. mainly fried rice and eeg,-2
2164,2023-10-14 13:48:56+08:00,Jiali Teo,to clear by 2pm,-2
2165,2023-10-14 13:48:56+08:00,Jiali Teo,also 5 vegetarian bentos,-2
2167,2023-10-14 21:18:56+08:00,Darren Quek,"hello, post bbq free food at nanyang executive club, next to squash court",-2
2170,2023-10-14 22:42:12+08:00,NTUFreeFood,cleared,2167
2172,2023-10-16 22:37:26+08:00,Nand!n¡ Nagar,"hello  clearing some bento sets at gaia, level 1 near drop off point (will be cleared by 1045)",-2
2175,2023-10-16 22:40:27+08:00,NTUFreeFood,cleared,2172
2179,2023-10-18 13:42:31+08:00,mei fang,there’s free food outside arc level 1 tr 19,-2
2180,2023-10-18 13:42:31+08:00,mei fang,there’s 11 nasi lemaks,-2
2181,2023-10-18 13:42:31+08:00,mei fang,to be consumed by 230pm,-2
2182,2023-10-18 13:46:10+08:00,Rachel,free ice cream for completed exhibition quiz. happening from now till 2pm at the green space. vote for the shoes and get a chance to participate in lucky draw happening this friday. the prize is a jbl speaker worth more than $100,-2
2183,2023-10-18 13:46:25+08:00,NTUFreeFood,nasi lemaks cleared,2179
2184,2023-10-18 13:50:37+08:00,NTUFreeFood,ice cream cleared,2182
2185,2023-10-18 14:12:44+08:00,Hean Zhor Sim,buffet in athena outside lwn library. to clear by 2.30pm.,-2
2186,2023-10-20 19:30:11+08:00,Jamie,"nie lt1 (block 5) - baked mini chicken pie, assorted mini swiss roll, traditional mini english carrot cake, steamed tom yum fish cake, steamed ngoh hiang roll, assorted brown rice sushi & maki platter, vegetarian wok-fried brown rice bee hoon (veg), low sugar chilled almond jelly w longan & pineapple",-2
2188,2023-10-24 13:53:30+08:00,Loi Jun Yan,"still some noodlse and veggies left, burbur chacha and drinks",-2
2189,2023-10-24 13:53:30+08:00,Loi Jun Yan,at tct lt,-2
2190,2023-10-26 10:46:05+08:00,Nadya Amira,free indonesian snacks available at the gem fair in nanyang auditorium right now  only until 3 pm ,-2
2191,2023-10-26 12:03:30+08:00,Nadya Amira,more snacks coming in  free indonesian chips available on gem fair at nanyang auditorium rn  only 50pax ,-2
2192,2023-10-26 13:28:53+08:00,Anenyaa,"hello, there’s 8 non veg chicken bentos to be consumed before 2.30pm at gaia lvl 2 sr7",-2
2193,2023-10-26 13:31:51+08:00,iris,"sandwiches, salads, desserts and drinks   location: hive tr+16   clearing time: 2pm",-2
