id,date,sender,text,clearedmsg
93,2018-01-05 18:27:07+08:00,PeerUser(user_id=263081514),free food at north hill rep room to be cleared at 7,-2
94,2018-01-09 11:09:22+08:00,PeerUser(user_id=465844271),leftover pasta and swiss rolls at nanyang auditorium now,-2
95,2018-01-10 18:21:45+08:00,PeerUser(user_id=267988270),"cultural night event at north spine, food lasts till 9pm",-2
96,2018-01-11 13:30:24+08:00,NTUFreeFood,tr9 at ns level 5 ,-2
97,2018-01-13 16:57:33+08:00,PeerUser(user_id=472565934),"lots of food left. hass foyer, opposite the hive",-2
98,2018-01-13 17:27:24+08:00,NTUFreeFood,food will be cleared at 6 ,-2
99,2018-01-16 18:29:35+08:00,PeerUser(user_id=524789793),buffet food at sbs,-2
100,2018-01-16 20:05:52+08:00,NTUFreeFood,hi all lotsa food at hss    it'll be cleared by 8.30pm so hurry down :-),-2
102,2018-01-17 21:16:47+08:00,PeerUser(user_id=265005788),hi  free food at nh’s bb court ,-2
103,2018-01-18 12:58:43+08:00,NTUFreeFood,food at adm audi. level 2. dessert meat vegetables rice mee goreng ,-2
106,2018-01-19 16:31:04+08:00,NTUFreeFood,"hi guys, hive level 1  not much left but if you're nearby you can grab whatever's remaining",-2
108,2018-01-19 17:05:44+08:00,NTUFreeFood,hi all  hss auditorium b1,-2
109,2018-01-19 19:27:42+08:00,PeerUser(user_id=280195515),the hive lvl 3. to be cleared at 10pm,-2
110,2018-01-20 16:42:42+08:00,PeerUser(user_id=48628073),hi all  n3-3 outside tr +7 level 5. it'll be cleared by 5.30pm,-2
111,2018-01-20 19:29:54+08:00,PeerUser(user_id=36604648),food left at   nanyang audi foyer  do come and help yourself (:,-2
112,2018-01-20 19:33:05+08:00,NTUFreeFood,clearing soon  ,111
113,2018-01-22 14:07:24+08:00,PeerUser(user_id=351334898),adm b1,-2
114,2018-01-22 14:09:01+08:00,NTUFreeFood,clearing soon ,113
115,2018-01-23 15:39:53+08:00,PeerUser(user_id=178790592),free drinks at canopy k  they will open their booth until 5 pm  come here to get some of these goodies 💃🏼,-2
116,2018-01-23 17:00:30+08:00,NTUFreeFood,update: cleared   // hi all  do head over to nbs s3 b4 to clear some leftovers  clearing by 5.30pm,-2
117,2018-01-23 19:57:02+08:00,NTUFreeFood,"hi all  outside lt47 at the hive, should be clearing around 930 but do go on down soon :-) - only beehoon left ",-2
118,2018-01-24 15:51:12+08:00,PeerUser(user_id=240091596),"free ice-cream, churros and thai iced tea | great performances and merchandise    come down to canopy stage (northspine plaza) this friday 26 jan from 11am to 5pm  follow  ushop.ntusu for more info :d",-2
119,2018-01-24 20:32:08+08:00,NTUFreeFood,"hi all, nbs conference room 2 (level b4)  will clear by 930pm",-2
120,2018-01-25 19:19:09+08:00,NTUFreeFood,hi all  complimentary drinks tomorrow at ntu southspine  feel free to come by and take :),-2
121,2018-01-26 15:13:31+08:00,NTUFreeFood,ushop has 450 cups of icecream to giveaway     earl grey oreo grape yakult  hurry down to northspine canopy stage    ,-2
122,2018-01-26 19:20:17+08:00,NTUFreeFood,hi guys  food at the theatre at the nest ,-2
124,2018-01-26 20:31:38+08:00,PeerUser(user_id=233867740),lots of good food leftover at the ntuitive hub  clearing soon so come quick,-1
125,2018-01-31 20:38:39+08:00,PeerUser(user_id=227646007),buffet left over outside global lounge. can come over now ,-2
126,2018-02-01 21:42:42+08:00,PeerUser(user_id=439864789),ntu free food outside the hive lt lvl 1  clearing at 10 pm,-2
129,2018-02-01 22:00:17+08:00,PeerUser(user_id=27752228),free cake   tr9,-2
131,2018-02-01 22:20:14+08:00,PeerUser(user_id=300098293),buffet uncleared outside tr121,-2
133,2018-02-02 14:45:12+08:00,PeerUser(user_id=479466592),free food at north spine ns1 level 4 lt 15,-2
134,2018-02-03 20:00:23+08:00,NTUFreeFood,"hi guys, leftovers outside hall 3 mph ",-2
135,2018-02-05 13:19:11+08:00,NTUFreeFood,"at sbs lobby; guests leave 130pm, clearing by 2pm",-2
136,2018-02-05 16:34:01+08:00,NTUFreeFood,"cleared   // hi guys, 2 trays of hotdogs and donuts left at sbs lobby ",-2
137,2018-02-07 13:09:26+08:00,NTUFreeFood,2 trays of nasi briyani at sbs lobby ,-2
138,2018-02-07 13:20:17+08:00,PeerUser(user_id=64161728),wkw fyp group on hidden sugars in everyday food giving out free goodie bags at south spine until 4pm,-2
139,2018-02-07 21:55:29+08:00,PeerUser(user_id=116314767),"hi theres a lot of packed food outside tr+56, do drop by for some free food     👍",-2
140,2018-02-08 12:42:29+08:00,PeerUser(user_id=36604648),"nanyang arts gallery is happening at sac from 11am to 9pm today  🎊🎉🎈come down to catch some artworks from students in ntu, and to catch the premiere of mediacorp toggle & mccy’s latest film, <dance with me> (airing from 12-3pm) 💃🏻🕺🏻  free ice cream is available for the 1st 300 participants  🍦🍦🍦",-2
141,2018-02-08 13:04:07+08:00,NTUFreeFood,"hi guys, not much left but sbs lobby has some leftovers  do head over if you're in the area",-2
142,2018-02-08 13:12:08+08:00,PeerUser(user_id=48628073),hi guys food over at wkw level 1  slated to clear 3pm but it may be gone by 2+,-2
143,2018-02-08 14:19:29+08:00,NTUFreeFood,"hi guys, happening at canopy stage at ns today  head on down for whatever's left:-)",-2
144,2018-02-08 15:41:25+08:00,NTUFreeFood,"hi guys, tea time desserts from the sbs lobby can be taken now ",-2
145,2018-02-10 14:15:25+08:00,PeerUser(user_id=34992732),buffet outside tct until 2:45pm,-2
146,2018-02-13 19:27:06+08:00,NTUFreeFood,hi guys food outside hss audi ,-2
148,2018-02-14 14:47:08+08:00,PeerUser(user_id=434373086),foods outside mse e-studio,-2
150,2018-02-20 01:23:42+08:00,NTUFreeFood,"hi all, 20th feb 530-730pm  sign-up link: http://tinyurl.com/ehack101",-2
151,2018-02-20 12:46:18+08:00,PeerUser(user_id=500869752),"free goodie bags, drinks, balloons & photobooth ($10 grab vouchers up for grabs) outside lt1a   just have to write a thank you post it  until 4pm",-2
152,2018-02-20 20:37:49+08:00,NTUFreeFood,"at the nest, inno centre bus stop  there's caramel pudding, fried rice, vegetables and curry chicken too  should be clearing soon ",-1
154,2018-02-21 11:01:58+08:00,PeerUser(user_id=403730936),"hi free pocky and pepero at the walkway near coffee bean   just need to play simple games(-:  it's a mental health awareness campaign called silent screams, today and thurs 10am-5pm, organised by wsc growth and opportunities in conjunction with many other orgs so do drop by our booths if you can (-:",-2
156,2018-02-21 13:40:26+08:00,PeerUser(user_id=48628073),free food & froyo at wkw level 4    clearing soon  ,-2
158,2018-02-21 16:51:15+08:00,PeerUser(user_id=507702648),free food at chc level 2 to be cleared at 530,-2
159,2018-02-21 21:54:26+08:00,NTUFreeFood,food over at north hill canteen ,-2
161,2018-02-22 13:29:46+08:00,NTUFreeFood,"hi all  presidential inauguration at nanyang audi, lots of leftovers ",-2
162,2018-02-22 14:16:34+08:00,NTUFreeFood,"hi all  there's a buffet at level 3 hive for an event, prob clearing soon  head on over :-)",-2
163,2018-02-23 16:48:09+08:00,NTUFreeFood,"hi guys, outside lwn library at ns ",-2
164,2018-02-23 17:08:28+08:00,PeerUser(user_id=212030986),hive l2 outside tr+54,-2
166,2018-02-23 20:00:29+08:00,PeerUser(user_id=239177025),nanyang house seminar room 2,-2
167,2018-02-23 20:00:40+08:00,NTUFreeFood,"hi all, food will be cleared around 9 ",-2
168,2018-02-26 13:39:49+08:00,PeerUser(user_id=287088463),"hive b2, outside tr34",-2
169,2018-02-26 16:25:17+08:00,NTUFreeFood,scbe n1.3 b5 ,-2
170,2018-02-26 16:47:08+08:00,NTUFreeFood,hi guys  this has been finished,169
171,2018-02-26 20:04:00+08:00,NTUFreeFood,"hi guys, refreshments are provided  sign up: https://goo.gl/forms/taepl8q1w9xtupvv1",-2
172,2018-02-26 20:15:21+08:00,PeerUser(user_id=48628073),"hey guys, lots of food outside lt 8 at north spine. clearing at around 9.30pm ",-2
174,2018-02-27 22:37:46+08:00,PeerUser(user_id=142179834),"ntuperks  bazaar is back again this year  organised by students union's corporate liaison office, come join us *this thursday, 10am to 6pm at south spine concourse*. be sure to be early in line to grab some amazing goodies we have for you  goodies include: -ice cream -popcorn -mcdonalds vouchers -rainbow cheese toast -mua chee -and many many more freebies and discounts  🥛🍦🍢💕👌🏻 see you there  ❤❤❤  for more information and discounts offered by our merchants, visit  http://www.ntusuclo.wixsite.com/ntuperks  to receive updates on the latest deals, visit: http://www.facebook.com/ntuperks http://www.instagram.com/ntuperks",-2
176,2018-02-28 15:18:18+08:00,NTUFreeFood,"hi all  there's laksa, mushroom soup, salad and tomato rice outside lt1 now ",-2
177,2018-03-01 12:22:48+08:00,PeerUser(user_id=131511868),come down to ntubazaar right now happening at southspine concourse for free food   featuring rainbow cheese toast ,-2
179,2018-03-01 13:21:10+08:00,NTUFreeFood,"scse lobby: duck, chicken, kam heong, drinks",-2
180,2018-03-01 13:50:34+08:00,PeerUser(user_id=465844271),leftovers at nie canteen b1 level now. to be cleared 2-2.30pm,-2
181,2018-03-01 16:03:46+08:00,PeerUser(user_id=121205566),hall 10 function hall still a lot. to be cleared by 4.30pm,-2
183,2018-03-01 18:13:23+08:00,PeerUser(user_id=484910427),jonny micay: free food...on a film set tomorrow  adm film students are searching for extras of chinese ethnicity for a chinese new year gathering scene. tomorrow - march 2nd - 11am-7pm  yewtee . please email jmicay gmail.com for some amazing free food on a fun movie set. please pm jonny micay for any more inquiries .,-2
184,2018-03-03 16:20:24+08:00,PeerUser(user_id=337482339),leftover bee hoon ans mee siam and sandwiches at reading room 1 and 2 at s3-b4 ,-2
185,2018-03-03 23:47:27+08:00,NTUFreeFood,"date: monday, 5 march 2018 time: 2pm - 4pm venue: lt29  refreshments provided   register for a place here: https://goo.gl/forms/b1jztmb3udqltk113",-2
186,2018-03-05 16:43:17+08:00,PeerUser(user_id=233877621),"mini egg sandwich, pizza, veg fried gyoza and choco cream puffs at lt29  :-)",-2
188,2018-03-05 17:32:27+08:00,NTUFreeFood,"just drinks left: coffee, tea, fruit punch",-2
189,2018-03-11 18:08:38+08:00,NTUFreeFood,"hi all, food over at lt6 ",-2
190,2018-03-13 14:08:24+08:00,NTUFreeFood,hi guys  leftovers at hive level 3,-2
191,2018-03-14 17:08:30+08:00,PeerUser(user_id=322912295),free food at nanyang audi exhibition hall lvl 3   lots of food  ,-2
193,2018-03-14 17:10:10+08:00,NTUFreeFood,will be cleared by 6pm  :),-2
194,2018-03-14 18:09:47+08:00,PeerUser(user_id=236883116),hi guys   free food at the rooftop  the hive ^-^ please help yourselves  ,-2
195,2018-03-14 20:10:49+08:00,NTUFreeFood,free food over at lt22,-2
196,2018-03-14 20:11:01+08:00,PeerUser(user_id=212786095),"another buffet ,right round lt23",-2
197,2018-03-14 21:06:27+08:00,NTUFreeFood,"hi guys there's 50 packs of nasi lemak, fried oreos and ice cream at north hill area while stocks last   30more mins ",-2
198,2018-03-14 22:34:56+08:00,NTUFreeFood,supper at crespion function hall now ,-2
199,2018-03-14 22:44:11+08:00,NTUFreeFood,food has been moved to middle of crespion canteen near drinks stall  a lot of fried rice left,-2
200,2018-03-14 23:21:32+08:00,NTUFreeFood,all cleared ,199
201,2018-03-15 19:08:16+08:00,NTUFreeFood,cleared,-1
202,2018-03-15 19:51:44+08:00,NTUFreeFood,outside lt3. pao is char siew pao,-2
203,2018-03-16 21:26:34+08:00,PeerUser(user_id=351334898),"in front of eee, south spine. predicting excess food.   veggies, meat and rice/noodle.",-2
204,2018-03-17 19:22:51+08:00,PeerUser(user_id=244656355),outside lt2a,-2
205,2018-03-18 15:23:32+08:00,PeerUser(user_id=286566100),pasta mania food outside lt26  come fast   :),-2
206,2018-03-18 18:45:28+08:00,PeerUser(user_id=230764164),17 packets of caifan outside lt2a,-2
207,2018-03-18 19:03:22+08:00,NTUFreeFood,there's still 15 packets left ,-2
208,2018-03-19 15:34:59+08:00,NTUFreeFood,"hi all, vegetarian food at sac meeting room 1 ",-2
209,2018-03-19 22:16:04+08:00,NTUFreeFood,hi guys  free beehoon and dessert outside lhs tr+51 (level 2 hive),-2
210,2018-03-20 13:14:55+08:00,PeerUser(user_id=48628073),hi all  food outside lt8 to be cleared by 2pm,-2
212,2018-03-20 13:27:13+08:00,PeerUser(user_id=418524749),"hi food outside hss audi, to be cleared at 230pm",-2
213,2018-03-20 14:25:49+08:00,PeerUser(user_id=48628073),hi guys  free halfboil eggs and kaya toast at wkw level 1  to be cleared by 4pm :-),-2
215,2018-03-20 14:34:07+08:00,NTUFreeFood,hi guys  earthlink ntu is giving out free ice cream at canopy k at ns  just have to like their fb page and do a survey ,-2
216,2018-03-21 20:19:06+08:00,PeerUser(user_id=232547188),free food at hss foyer  will be cleared by 9 ,-2
217,2018-03-21 20:19:06+08:00,PeerUser(user_id=421083007),food at student services centre level 1. will clear at 830pm ,-2
218,2018-03-21 20:19:06+08:00,PeerUser(user_id=198487821),"food at sbs cr1, will be cleared by 845",-2
219,2018-03-21 22:20:11+08:00,PeerUser(user_id=259962887),"some fried rice & noodles at crescent hall cult room 1 (1 floor above canteen, beside the vending machine cafe)  😊 pls help yourselves  ",-2
220,2018-03-21 23:39:18+08:00,NTUFreeFood,cleared ,219
221,2018-03-22 14:26:11+08:00,PeerUser(user_id=37551554),spms beside printing room to be cleared by 3,-2
222,2018-03-22 20:34:38+08:00,PeerUser(user_id=211886716),food   hive tr+ 33. clearing by 9.10pm,-2
223,2018-03-24 20:10:35+08:00,NTUFreeFood,"until 930pm at yuhua cc (chinese garden mrt) there is a lot (at least 2 full plates of all) + drinks   damn delish also: lotus leaf rice with lotus seeds and dates, tofu with enoki mushroom, broccoli, spicy mock squid rings, mock pork with longan and pineapple",-2
227,2018-03-26 19:09:03+08:00,NTUFreeFood,[cleared] outside lt6. honey chicken drumlet and egg mayo sandwiches. clear by 8pm,-2
228,2018-03-27 19:59:30+08:00,PeerUser(user_id=387657468),free food at theatre at nest clearing in 15 mins,-2
230,2018-03-27 22:29:54+08:00,PeerUser(user_id=313557092),hello  tr25 at hive got beehoon    just beehoon though. they are clearing now and got a lot left ):,-2
232,2018-03-28 17:16:55+08:00,PeerUser(user_id=48628073),hi all a lot of extra food at hive level 1 ,-2
234,2018-03-28 20:14:01+08:00,NTUFreeFood,"espace n4.1-b2: samosas, cocktail fruits, stir fried prawn, curry chicken, mushroom broccoli, beehoon",-2
235,2018-03-28 20:23:09+08:00,NTUFreeFood,"at nanyang executive centre level 3, to be cleared around 9pm",-2
242,2018-03-28 20:38:23+08:00,NTUFreeFood,food over at b2 of hive  ,-2
243,2018-03-28 21:26:22+08:00,NTUFreeFood,lots of leftovers at sbs foyer  ,-2
244,2018-03-29 18:45:35+08:00,PeerUser(user_id=113638484),"some drinks (water, h2o, apple juice packets), assorted biscuits and raisins at tables behind coffee bean",-2
245,2018-03-31 13:50:55+08:00,PeerUser(user_id=383580637),"free bento   ns canopy k, come get by 2pm ",-2
246,2018-04-02 10:32:47+08:00,NTUFreeFood,at lt9  probably clearing by 1130am,-2
248,2018-04-02 12:56:25+08:00,NTUFreeFood,"the lt9 food still there: salad, fried rice, dessert, drinks, salad, beehoon, veggies",-2
249,2018-04-04 12:23:16+08:00,PeerUser(user_id=48628073),hi all  at north spine: ntusu u-study welfare pack giveaway   free coffee free soft serves first 1500 people get milk tea from sharetea along with welfare packs  from 12:00pm onwards,-2
250,2018-04-04 14:16:19+08:00,PeerUser(user_id=53087310),free food at hive lvl 2,-2
251,2018-04-04 14:16:19+08:00,PeerUser(user_id=53087310),"supposed to clear at 2pm, grab it asap",-2
252,2018-04-04 14:34:42+08:00,PeerUser(user_id=238721177),free ice cream outside lt3,-2
253,2018-04-04 15:04:52+08:00,NTUFreeFood,cleared ,252
254,2018-04-10 13:43:29+08:00,NTUFreeFood,"hi all  date: 11 april 2018, weds time:  12 - 4 pm venue: lt1  interesting talk about food waste w a free tea reception & free bamboo straws  register: http://tinyurl.com/2018-fws",-2
258,2018-04-10 17:48:21+08:00,NTUFreeFood,"porridge, tausuan, fruit cocktail outside lt27",-2
259,2018-04-11 19:34:46+08:00,NTUFreeFood,"hi all  leftovers outside lt1, shld be clearing in about 30mins ",-2
260,2018-04-12 11:27:34+08:00,NTUFreeFood,hi all  there will a free scooped ice cream giving at north spine canopy k 1.45pm   (just like their instagram and facebook page www.facebook.com/72lc) go on down and grab a stick   *while stocks last,-2
261,2018-04-12 14:59:13+08:00,PeerUser(user_id=398000342),free welfare pack   :) there's oreos inside  s4 b2 benches,-2
262,2018-04-15 21:51:19+08:00,NTUFreeFood,hi all  halal food at hive level 3 beside tr 56 :-) ,-2
263,2018-04-17 15:48:04+08:00,PeerUser(user_id=45362116),"hi  there’s snacks (m&m, kitkat, cheese balls, potato chips) provided by ntusu at hive, b5 as part of the u-care event. there’re also stress balls, note books, post its and plastic folders :)",-2
266,2018-04-19 12:45:50+08:00,NTUFreeFood,hi all  leftover halal certified buffet at innovation centre block 1 - until 2.30pm ,-2
267,2018-04-22 19:52:59+08:00,PeerUser(user_id=60092792),there’s free leftover bento boxes with really good food at hive level 3 tr 56,-2
268,2018-05-07 12:58:39+08:00,NTUFreeFood,"hi all, buffet at lt22 south spine, should be clearing at 130pm ",-2
269,2018-05-11 13:34:07+08:00,PeerUser(user_id=383580637),"hi all, there's free food (fish, curry chicken, pineapple fried rice etc) and desserts (tiramisu, cheese tart etc)   abd-b2b-10 (outside psp) until 2pm ",-2
270,2018-05-12 16:56:55+08:00,PeerUser(user_id=420056148),hi guys. theres some food left in spms mas atrium.,-2
271,2018-05-12 17:13:49+08:00,NTUFreeFood,"free food outside lt 23 beehoon, grass jelly, samosa, dumpling, sandwiches, soonkueh, fish filet",-2
273,2018-05-12 18:30:06+08:00,NTUFreeFood,"hi guys  tuna sandwiches (be cautious as these were from the morning), mantous, springrolls, cheesebuns in global lounge (ns next to canopy k stage)",-2
274,2018-05-13 10:17:51+08:00,PeerUser(user_id=129195100),hi guys there’s lee wee & brothers’ nasi lemak at hive lvl 1 lt. do come down to help clear  :),-2
275,2018-05-17 14:20:59+08:00,NTUFreeFood,"hi guys, food getting cleared from n2-01c in about 15 minutes ",-2
276,2018-05-19 16:20:43+08:00,NTUFreeFood,hi   lots of food at hive level 2   food will be clearing at 5   also more outside hss foyer and auditorium,-2
277,2018-05-21 13:38:31+08:00,NTUFreeFood,hi all  nie block 2 has some leftover rice ,-2
278,2018-05-25 16:19:04+08:00,PeerUser(user_id=133611884),london choco rolls at sbs lobby,-2
279,2018-05-26 12:38:14+08:00,PeerUser(user_id=476709421),"bento boxes from mum's kitchen. still warm. at 71 nanyang drive, ntu innovation centre, level 3, s638075.",-2
280,2018-05-26 19:38:31+08:00,NTUFreeFood,"hi guys, food at adm basement ",-2
281,2018-05-27 13:20:56+08:00,PeerUser(user_id=476709421),"bento sets from mum's kitchen. still warm. at 71 nanyang drive, ntu innovation centre. level 3 open area. s638075.",-2
283,2018-06-01 17:43:50+08:00,NTUFreeFood,hi guys  8 tables of food over at nanyang audi level 3 ,-2
284,2018-06-01 17:44:48+08:00,NTUFreeFood,food over at lt2a  clearing at 7pm but only beehoon and kueh left ,-2
285,2018-06-05 16:30:59+08:00,NTUFreeFood,"update: food cleared // hi all, lots of food left at the hive b1 tr+45. clearing at 5pm",-2
286,2018-06-20 13:21:55+08:00,PeerUser(user_id=174525977),"free food in nie tr708, come while stocks last ",-2
287,2018-06-23 13:56:54+08:00,PeerUser(user_id=208049291),free food at koufu  14 boxes. to be cleared by 2.15pm,-2
288,2018-06-23 14:09:03+08:00,NTUFreeFood,all cleared ,287
289,2018-06-30 14:52:57+08:00,PeerUser(user_id=48628073),"hi all  some help needed to rescue food. there is enough food for about 20 pax in new innovation centre, level 3. its behind the arc, near mae. 71 nanyang drive",-2
290,2018-07-09 14:02:38+08:00,NTUFreeFood,hi guys  9 bento boxes leftover at hive level 1  ,-2
291,2018-07-09 14:28:00+08:00,NTUFreeFood,cleared ,290
292,2018-07-09 16:06:42+08:00,NTUFreeFood,update: cleared // hi guys  leftover finger food over at hive level 1,-2
293,2018-07-10 13:52:54+08:00,NTUFreeFood,update: cleared // hi guys  more leftovers over at hive level 1 ,-2
294,2018-07-11 13:41:49+08:00,NTUFreeFood,"hi all, food over at the arc tr+10  clearing in about 20 minutes",-2
295,2018-07-24 18:28:10+08:00,NTUFreeFood,"update: cleared   // food available in hive tr+52 level 2, clearing by 650pm   rice, siewmai, butter cake",-2
296,2018-07-25 22:51:20+08:00,PeerUser(user_id=91150789),free food at meranti hall   please come   thanks,-2
297,2018-07-25 23:24:58+08:00,NTUFreeFood,cleared  ,296
298,2018-07-26 13:56:56+08:00,NTUFreeFood,hi all   there is food at nie linkway1 clearing in 20mins,-2
299,2018-07-30 16:54:06+08:00,PeerUser(user_id=231332904),some food left at hive level 1. clearing at 5pm,-2
301,2018-07-30 16:54:06+08:00,PeerUser(user_id=231332904),"some food left at hive level 1, clearring at 5pm",-2
302,2018-08-01 13:05:35+08:00,PeerUser(user_id=244579399),hi we have many bento sets  from tamarind hall canteen  cheers :),-2
303,2018-08-01 20:42:04+08:00,PeerUser(user_id=28812626),hall 11 canteen - 7 bento boxes incl 2 vegetarian meals,-2
307,2018-08-02 15:13:50+08:00,PeerUser(user_id=480197338),food available outside lt22 south spine,-2
308,2018-08-02 15:30:27+08:00,NTUFreeFood,hi guys   food over at yunnan corner (opposite hall 1). clearing at 4.30pm,-2
309,2018-08-04 20:20:27+08:00,PeerUser(user_id=205040380),there are 9 packets of vegetarian food at hall 11. please look for red plastic bag and feel free to take by 10pm,-2
310,2018-08-04 20:20:27+08:00,PeerUser(user_id=205040380),infront of japanese store,-2
311,2018-08-07 12:17:27+08:00,PeerUser(user_id=200946490),hi guys there are 10+ packets of fried rice+chicken and another 10+ packets of vegetarian food at scbe building n1.2 b2 level  feel free to take by 1.30pm,-2
312,2018-08-07 12:31:02+08:00,PeerUser(user_id=587245446),"pineapple fried rice, dry mee siam , curry and more at school of humanities foyer. clearing at 1.30pm",-2
313,2018-08-07 14:31:13+08:00,PeerUser(user_id=48628073),hi guys  18 packs of food available at s4-b3  clearing at 330pm,-2
314,2018-08-07 20:31:50+08:00,PeerUser(user_id=290537505),there is 30 packet rice at hss foyer  can come and take ☺️,-2
315,2018-08-08 16:03:52+08:00,PeerUser(user_id=296382900),bento boxes at spms mas atrium  but the best before is 3pm,-2
316,2018-08-08 21:19:54+08:00,PeerUser(user_id=290537505),"there’s a lot of packet food at hss foyer, near the tables  do come over to take if you’re in school 🙂",-2
317,2018-08-11 12:55:43+08:00,PeerUser(user_id=233867740),leftover food at the arc learning hub clearing soon ,-1
318,2018-08-11 13:05:50+08:00,PeerUser(user_id=62833264),"15 packets of lunch at s4, level b2 outside sr6  to be consumed by 130pm ",-2
319,2018-08-14 11:16:24+08:00,PeerUser(user_id=176486531),"free churros and sure-win wind chamber outside lt07    to redeem, you have to download our plus  (ntuc plus on app store) app and register as a member. free hotel stays to be won on fb ( mypluslife).",-2
320,2018-08-15 11:26:19+08:00,NTUFreeFood,hi all  food outside lt19a to be cleared around 12,-2
321,2018-08-15 20:58:11+08:00,PeerUser(user_id=427459426),leftover food at src sh2 clearing at 9.30pm,-2
322,2018-08-16 11:57:44+08:00,PeerUser(user_id=528976583),lt27 clearing by 12pm ,-2
324,2018-08-16 19:13:46+08:00,PeerUser(user_id=686081509),experimental medicine building,-2
325,2018-08-16 20:18:16+08:00,PeerUser(user_id=48628073),"hi all    leftovers outside hall 11 admin office, bring your own plates and utensils ",-2
326,2018-08-16 20:29:18+08:00,PeerUser(user_id=211886716),lt27. food will be cleared by 9pm,-2
327,2018-08-17 16:41:46+08:00,PeerUser(user_id=421853246),"free food outside lt27  there's fried bee hoon, satay, otah, muruku and chiu kueh  ",-2
328,2018-08-17 17:06:44+08:00,PeerUser(user_id=218504377),"leftover food (including a tray of untouched beehoon) at lhs tr+56, lvl 3 hive to be cleared at 5.30pm",-2
329,2018-08-17 20:42:58+08:00,PeerUser(user_id=48628073),hi guise food over at hive tr+47  clearing at 930,-2
330,2018-08-17 20:53:51+08:00,PeerUser(user_id=48628073),hi guise  8 remaining leftover packets of mixed rice outside nie lt 7 (halal) (supposed to b consumed by 830 tho),-2
331,2018-08-18 21:23:30+08:00,PeerUser(user_id=285317906),leftover bbq food at hall 12/13 bbq pit  clearing at 1030pm,-2
332,2018-08-20 19:30:53+08:00,PeerUser(user_id=83226751),"food outside hss audi, clearing at 8 ",-2
333,2018-08-21 12:35:13+08:00,NTUFreeFood,"outside lt18 - kuay teow, mushroom puff, almond beancurd longan",-2
334,2018-08-21 18:49:27+08:00,NTUFreeFood,"outside lt 8: thai mix salad, rice, wholegrain aglio olio, pan fried fish filet with lemon butter sauce, honey mustard chicken, spinach, mango puree with berries, pokka sparkling apple",-2
335,2018-08-23 19:55:00+08:00,NTUFreeFood,"outside lt6: éclairs, grass jelly, hoeny chicken, fish, fried rice with raisins, pasta, tofu, vegetables, water, fruit punch",-2
336,2018-08-24 18:17:25+08:00,NTUFreeFood,"hi all, spaghetti and drinks outside hive room tr+ 53",-2
337,2018-08-25 13:03:04+08:00,PeerUser(user_id=164991682),"free food at nanyang house, outside 02-212. 10 packs of lee wee brothers",-2
338,2018-08-25 13:44:01+08:00,NTUFreeFood,[cleared] hi guys  14 packets of indian food outside lt03 now.,-2
339,2018-08-28 13:49:08+08:00,PeerUser(user_id=311682526),"leftover food at ntu innovation centre (behind the arc, 71 nanyang drive level 3)",-2
340,2018-08-28 14:58:13+08:00,NTUFreeFood,cleared ,339
341,2018-08-29 15:09:41+08:00,PeerUser(user_id=421083007),"free buffet at sbs lobby, clear by 4pm. got spring roll, siew mai, sandwich, eclairs, coffee and tea.",-2
343,2018-08-29 19:31:25+08:00,NTUFreeFood,"hi all  food over at 71 nanyang drive, #03-01, ntu innovation centre, singapore 638075. should be clearing in about 30mins",-2
344,2018-08-30 19:25:51+08:00,NTUFreeFood,"hi guys  some food over at ns, behind long john silver. should be clearing at 9",-2
